[
{"Id":1,"Medals":0,"PrizeGeneralId":0,"PrizeGold":60000,"PrizeIndustry":0,"PrizeEnergy":0,"PrizeTech":0,"PrizeMerit":0,"PrizeDecoration":0,"GeneralMedal":[],"Elite":0,"Item":[]},
{"Id":2,"Medals":500,"PrizeGeneralId":0,"PrizeGold":0,"PrizeIndustry":0,"PrizeEnergy":0,"PrizeTech":0,"PrizeMerit":0,"PrizeDecoration":0,"GeneralMedal":[],"Elite":0,"Item":[]},
{"Id":3,"Medals":0,"PrizeGeneralId":0,"PrizeGold":0,"PrizeIndustry":15000,"PrizeEnergy":0,"PrizeTech":0,"PrizeMerit":0,"PrizeDecoration":0,"GeneralMedal":[],"Elite":0,"Item":[]},
{"Id":4,"Medals":0,"PrizeGeneralId":0,"PrizeGold":0,"PrizeIndustry":0,"PrizeEnergy":5000,"PrizeTech":0,"PrizeMerit":0,"PrizeDecoration":0,"GeneralMedal":[],"Elite":0,"Item":[]},
{"Id":5,"Medals":0,"PrizeGeneralId":0,"PrizeGold":0,"PrizeIndustry":0,"PrizeEnergy":0,"PrizeTech":500,"PrizeMerit":0,"PrizeDecoration":0,"GeneralMedal":[],"Elite":0,"Item":[]},
{"Id":6,"Medals":0,"PrizeGeneralId":0,"PrizeGold":0,"PrizeIndustry":0,"PrizeEnergy":0,"PrizeTech":0,"PrizeMerit":0,"PrizeDecoration":0,"GeneralMedal":[2341,3],"Elite":0,"Item":[]},
{"Id":7,"Medals":0,"PrizeGeneralId":1072,"PrizeGold":0,"PrizeIndustry":0,"PrizeEnergy":0,"PrizeTech":0,"PrizeMerit":0,"PrizeDecoration":0,"GeneralMedal":[],"Elite":0,"Item":[]},
{"Id":8,"Medals":0,"PrizeGeneralId":0,"PrizeGold":0,"PrizeIndustry":0,"PrizeEnergy":0,"PrizeTech":0,"PrizeMerit":0,"PrizeDecoration":0,"GeneralMedal":[2331,3],"Elite":0,"Item":[]},
{"Id":9,"Medals":0,"PrizeGeneralId":0,"PrizeGold":0,"PrizeIndustry":0,"PrizeEnergy":0,"PrizeTech":0,"PrizeMerit":0,"PrizeDecoration":0,"GeneralMedal":[2321,3],"Elite":0,"Item":[]},
{"Id":10,"Medals":0,"PrizeGeneralId":0,"PrizeGold":0,"PrizeIndustry":0,"PrizeEnergy":0,"PrizeTech":0,"PrizeMerit":0,"PrizeDecoration":0,"GeneralMedal":[2311,3],"Elite":0,"Item":[]},
{"Id":11,"Medals":0,"PrizeGeneralId":0,"PrizeGold":0,"PrizeIndustry":0,"PrizeEnergy":0,"PrizeTech":0,"PrizeMerit":50,"PrizeDecoration":0,"GeneralMedal":[],"Elite":0,"Item":[]},
{"Id":12,"Medals":600,"PrizeGeneralId":0,"PrizeGold":0,"PrizeIndustry":0,"PrizeEnergy":0,"PrizeTech":0,"PrizeMerit":0,"PrizeDecoration":0,"GeneralMedal":[],"Elite":0,"Item":[]},
{"Id":13,"Medals":0,"PrizeGeneralId":0,"PrizeGold":0,"PrizeIndustry":0,"PrizeEnergy":0,"PrizeTech":0,"PrizeMerit":0,"PrizeDecoration":0,"GeneralMedal":[2042,2],"Elite":0,"Item":[]},
{"Id":14,"Medals":0,"PrizeGeneralId":0,"PrizeGold":0,"PrizeIndustry":0,"PrizeEnergy":0,"PrizeTech":0,"PrizeMerit":0,"PrizeDecoration":0,"GeneralMedal":[],"Elite":0,"Item":[111,30]}
]